{
  "schema_version": "1.0-proposed",
  "delivery_key": "demo-plan-2026-10-email-001",
  "connection_id": "33333333-3333-4333-8333-333333333333",
  "channel": "email",
  "mode": "snapshot",
  "period_from": "2026-10-01",
  "period_to": "2026-10-31",
  "timezone": "Europe/Moscow",
  "generated_at": "2026-10-05T07:15:00+03:00",
  "chunk_index": 1,
  "chunk_count": 2,
  "parts": [
    {
      "part_index": 1,
      "dataset": "plan",
      "format": "csv",
      "content_sha256": "2c624232cdd221771294dfbb310aca000a0df6ac57b6b1b4d8e2c9d0d4e8f1a2",
      "filename": "planned_cash_part1.csv",
      "encoding": "utf-8"
    },
    {
      "part_index": 2,
      "dataset": "plan",
      "format": "json_records",
      "content_sha256": "ef2d127de37b942baad06145e5b971d9103a3ed1a5fd8079885e4286a2c4d5e6",
      "records": [
        {
          "external_id": "PLAN-OUT-150K",
          "direction": "out",
          "amount": "150000.00",
          "currency": "RUB",
          "due_date": "2026-10-20",
          "expected_date": "2026-10-20",
          "category_code": "SUPPLIERS",
          "counterparty_inn": "",
          "confidence": "confirmed",
          "priority": "critical",
          "wallet_code": "MAIN"
        }
      ]
    }
  ]
}
